{"expected":{"capacity_phase":"ABSENT","generation":4,"names":[],"transaction_phase":"RETENTION_HANDOFF_COMPLETE"},"kind":"impossible","observed":{"capacity_phase":"RETENTION_HANDOFF_PROOFED","generation":4,"names":["h"],"transaction_phase":"RETENTION_PREPARED"},"reason_code":"predecessor_mismatch","release_id":"release-0.2.1","schema":"kilix.content.retention/v1","state_digest":"0000000000000000000000000000000000000000000000000000000000000072","version":1}
